{
  "artifact": {
    "file": "fable5_itsuwari-hyomen.html",
    "screenshots": [
      "loop/state/itsuwari-hyomen/shots/small_final.png",
      "loop/state/itsuwari-hyomen/shots/small_intact.png",
      "loop/state/itsuwari-hyomen/shots/F1_final_warm.png",
      "loop/state/itsuwari-hyomen/shots/F2_intact.png",
      "loop/state/itsuwari-hyomen/shots/F3_dbg1_mask.png",
      "loop/state/itsuwari-hyomen/shots/F4_dbg2_bw.png",
      "loop/state/itsuwari-hyomen/shots/F5_dbg3_blocks.png",
      "loop/state/itsuwari-hyomen/shots/F6_dbg4_specimen.png",
      "loop/state/itsuwari-hyomen/shots/crop_hole_edge.png",
      "loop/state/itsuwari-hyomen/shots/crop_intact_face.png",
      "loop/state/itsuwari-hyomen/shots/crop_pile.png"
    ]
  },
  "stance": "reject-seeking",
  "first_impression": "brief 未読の状態で small_final.png を見た第一印象: 室内(吊りランプ・窓・本棚)にいる赤い服の人物の表面が灰色の裂け目状に剥がれ落ち、剥がれた奥に色のない灰色の世界が覗き、小さな紙片状の正方形ブロックが降り注いで足元に山を作っている——「表面が貼りものとして崩落していく人物と部屋」に見えた。brief のテーマ(偽りの表面: 剥離・白黒の裏世界・ブロック堆積)と第一印象は一致しており、ゲシュタルト失敗はない。",
  "scores": [
    {
      "invariant_id": 1,
      "score": 5,
      "evidence": "F2_intact.png と crop_intact_face.png を等倍まで確認: 無傷面(顔・服のストライプ・壁のグラデーション)に継ぎ目・格子・タイル感は皆無。定量でも F2 の輝度勾配の行/列平均に対する FFT で、F3 のセルピッチ(約25px, 周期18〜30px帯)の周期成分はノイズ平均の 3.07 倍(x)/2.47 倍(y)に留まり、周期構造なし(疑陽性閾値 5 未満)。一方 F3_dbg1_mask.png は剥離状態がグリッドセル単位で管理されている実体を示し、F1_final_warm.png の落下ブロックは正方形パネル——グリッドの存在は剥離して初めて露出する。騙し絵の反転が成立している。",
      "reject_reasons": [
        "仮説「無傷面に微弱なタイル継ぎ目が残る」→ FFT 周期解析と等倍クロップ目視で反証",
        "仮説「無傷面が事前タイル分割の再合成(モザイク的)」→ F2 の連続グラデーションに量子化痕なし、反証"
      ]
    },
    {
      "invariant_id": 2,
      "score": 4,
      "evidence": "crop_pile.png と F1 の堆積部の拡大(左山 x130-480/右山 x480-830)を確認: 個々のブロックが別々の回転角で傾き、重なり・隙間を持って2つの山なりに堆積。整列・等間隔・同位相は見つからず、ref_pile_kotonoha.png の「傾き・重なり・隙間を持つ非整列の山」と同質(文字→正方形パネルの置換)。F5_dbg3_blocks.png でボディは有界数で、針山(CRAFT §E2)や宙吊りはない。減点理由: (1) 等倍で剛体同士の食い込み(深い重なり)が散見される、(2) F5 で堆積下地が直線斜面の完全三角形シルエットとして見えており(最終合成では露出していないが)、マージ済み堆積の近似が幾何的に粗い。",
      "reject_reasons": [
        "仮説「ブロックが整列/同位相で落ちるトランジション」→ 回転角・位置の分散を目視で確認し反証",
        "仮説「針山・宙吊り(CRAFT E2)」→ 山なりの安息角と接地を確認し反証",
        "残る疑い: 剛体の相互貫入と、堆積マージ形状の完全三角形近似(最終絵には非露出のため 4 に留める減点)"
      ]
    },
    {
      "invariant_id": 3,
      "score": 4,
      "evidence": "F1 等倍と crop_pile.png: 各ブロックはフルカラーの映像片を携え、その内容が元位置UVと整合する(赤い服の直下には縞グラデーション入りの赤ブロック、顔の周囲に肌色ブロック、窓の近傍に空色ブロック、ランプ/黄本由来の黄ブロック)。剥離穴の上に重なるブロックだけがカラーで、背後の穴は白黒——ブロックが合成後の画面でなく凍結スナップショットを参照している構造的証拠。F6_dbg4_specimen.png 中段はスナップショット世代(カラー→減光→無彩)の標本を直接示す。「破片の中は止まり裏世界だけが動く」という時間差そのものは静止画から判定せず、V1 運動応答 pass(裏世界のライブ性を含む)に委ねる。凍結が「剥離した瞬間」のフレームであることまでは静止画で確定できないため 5 は付けない。",
      "reject_reasons": [
        "仮説「破片がライブ映像を映す窓(核の喪失)」→ 白黒穴上のブロックがカラーを保持しており、ライブ合成参照でないことを反証",
        "仮説「ブロック内容が元位置UVと無関係な単色」→ 縞・肌・窓色の origin 整合で反証"
      ]
    },
    {
      "invariant_id": 4,
      "score": 4,
      "evidence": "F4_dbg2_bw.png を全画素計測: 彩度は最大値含め 0.0000(完全無彩)。輝度ヒストグラムは 4 つの離散トーン(bin≈7/31/67/103)に集中し上位8binで全体の71%——粗いポスタライズが実在。全オブジェクト(人物・窓桟・ランプ・棚・床境界)に sobel 由来の黒い輪郭線。合成後の暗さも実測: F1 の剥離穴内輝度 97.7/255 に対し同領域の生映像(F2)は 157.2——裏世界は暗く沈み、F4 同領域(96.3)とも一致し後処理の明度改変なし。ref_bw_world_overflowing_aura.png の「輪郭+少数トーン」系統に対し、brief 指定どおり彩度ゼロ・暗め化されている。減点理由: ランプの光暈と顔の陰影に滑らかなグラデーションが残り(上位トーン外の約29%)、「輪郭線と粗い明暗のみ」が部分的に希釈されている。",
      "reject_reasons": [
        "仮説「裏世界に彩度が残る」→ 全画素計測 sat=0.0000 で反証",
        "仮説「ポスタライズ偽装(実は連続階調)」→ 4離散トーンへの71%集中で反証",
        "仮説「穴の中だけ後処理で明度を持ち上げている」→ F1穴内 97.7 vs F4 96.3 の一致で反証",
        "残る疑い: 光暈・顔陰影の滑らかな成分(減点済み)"
      ]
    },
    {
      "invariant_id": 5,
      "score": 4,
      "evidence": "静止画で判定可能な構造的証拠のみで採点: F3_dbg1_mask.png で剥離は3つの局所クラスタ(各≈150〜250px、手のひら大)に留まり、グリッド全体の剥離率は実測 11.9%——1クリック全面崩壊は起きていない。各クラスタは赤いコアをオレンジのフロンティアセルが縁取り、内部に未剥離の島と穴を残す不規則形状——半径減衰+支持喪失伝播の「パラパラした追い崩れ」の痕跡と整合。F6_dbg4_specimen.png 下段の3状態(部分剥離→伝播拡大→回復)も伝播が有限で収束することを示す。時間的な追い崩れの減衰そのものは V1 運動応答 pass に委ね、静止画根拠のみでの減点はしない。",
      "reject_reasons": [
        "仮説「1クリックで全面崩壊(伝播の暴走)」→ 剥離率11.9%・有界クラスタで反証",
        "仮説「剥離形状が円盤スタンプ(伝播なしの一撃)」→ 不規則境界・内部島・フロンティア縁で反証"
      ]
    },
    {
      "invariant_id": 6,
      "score": 4,
      "evidence": "静止画の構造的証拠: F6_dbg4_specimen.png 下段の右パネルは中央パネルより剥離セルが明確に減り、服の赤とランプの点灯が戻っている——修復が端から埋まる形で機能している標本。堆積高さは F1/F5 とも画面高の約1/4で有界、ボディ数も有界。F6 中段の世代標本はカラー→無彩→減光の退色パイプラインの実在を示す。長時間挙動(発散・whiteout・枯渇なし)は V1 長時間安定 pass(mean 136.4→136.5, white 0.00%)が担保しており、静止画で時間性が見えないことを理由とした減点はしない。5 を付けないのは、最終絵 F1 内で退色途中の半透明破片を直接確認できず「破片が白黒世界に同化して消える」画面上の証拠が標本経由に留まるため。",
      "reject_reasons": [
        "仮説「修復がフェード(全面が薄く戻る)」→ F6 下段右のセル単位の回復(端から埋まる)で反証",
        "仮説「堆積が無限成長」→ V1 longrun pass と有界な堆積高さで反証",
        "残る疑い: 最終合成内での破片退色の直接証拠が薄い(標本と実測輝度安定で代替)"
      ]
    }
  ],
  "common": {
    "style_holds": 4,
    "subject_readable": 4,
    "artifact_free": 4
  },
  "verdict": "pass",
  "summary": "第一印象(brief未読)は「部屋の中の人物の表面が貼りものとして剥がれ落ち、正方形の紙片が堆積する」でテーマと一致——ゲシュタルト失敗なし。拒否志向で各不変量の偽装仮説を計測込みで潰した結果: 無傷面の継ぎ目ゼロ(FFT周期3.07倍<閾値5)で騙し絵の反転が成立(inv1=5)、裏世界は彩度0.0000・4離散トーン71%・穴内輝度97.7 vs 生映像157.2で暗く沈む(inv4=4)、ブロックは元位置UVの凍結カラーを携え白黒穴上でもカラー保持(inv3=4)、堆積は非整列・回転・山なりでref_pile_kotonohaと同質(inv2=4)、剥離は11.9%の有界クラスタ+フロンティア縁で部分崩壊(inv5=4)、修復はF6標本のセル単位回復とV1 longrun安定で担保(inv6=4)。残る軽微な疵は剛体の相互貫入、裏世界の光暈・陰影に残る滑らかな階調、破片退色の直接証拠の薄さで、いずれも4点相当。全不変量≥4かつ共通3軸≥4のため pass。"
}
