{
  "artifact": {
    "file": "fable5_blue-dissolve.html",
    "screenshots": [
      "loop/state/blue-dissolve/shots/final.png",
      "loop/state/blue-dissolve/shots/small.png",
      "loop/state/blue-dissolve/shots/crop.png",
      "loop/state/blue-dissolve/shots/debug1.png",
      "loop/state/blue-dissolve/shots/debug2.png",
      "loop/state/blue-dissolve/shots/debug4.png",
      "loop/state/blue-dissolve/shots/debug5.png"
    ]
  },
  "stance": "reject-seeking",
  "scores": [
    {
      "invariant_id": 1,
      "score": 4,
      "evidence": "「オーバーレイ合成の偽装」を疑ったが反証された: debug2(流体密度)で人物内部が完全な空洞(障害物)になっており、密度の根がすべてシルエット境界に接している=煙は帯から実際に放出されている。debug4で境界に沿った明るいSDF帯を確認。final.png右肩(640,300付近の等倍拡大)で帯の白い芯が画面中最も明るく、内側は灰色の実体・外側は青い気体への遷移がある。減点理由: 帯が全周ほぼ一定幅の滑らかなネオン管状で、帯上での実体/気体の「混在」(縁の食われ・ちぎれ)が等倍でも見えず、輪郭ストローク+グローに近い読み味が残る",
      "reject_reasons": [
        "帯が全周一様幅で、混在・侵食のテクスチャが帯上に見えない"
      ]
    },
    {
      "invariant_id": 2,
      "score": 5,
      "evidence": "「スプライト貼り付け」を疑ったが反証された: debug2(流体密度)で両腕上方にマッシュルーム状の渦のロールアップ、右側面に減衰しながら蛇行して漂う連続フィラメント、上昇傾向を確認。人物内部は密度ゼロの空洞で実体側を避けている。final.png左上の手周辺の等倍拡大(380,100-620,340)でも同じキノコ雲状の渦構造が発光煙として現れており、貼り付けスプライトの反復パターンや切れ目は見つけられなかった"
    },
    {
      "invariant_id": 3,
      "score": 4,
      "evidence": "final.pngとcrop.pngで確認: 煙は暗背景に対して明確に自発光し、薄い縁は深青に沈み芯はシアンへ飽和するランプが読める。帯の白い芯の周囲に狭い強いグローと広い淡いハローの二段のにじみがあり多段ブルームは実在。減点理由: 白青まで飽和するのはほぼSDF帯上のみで、煙自体の高密度芯(手の上の渦)はシアン止まりが多く「密度の高い芯ほど白青く」が弱い。残光(feedback減衰)は静止画1枚では検証不能",
      "reject_reasons": [
        "煙の高密度部が白まで飽和せずシアン止まり",
        "残光は静止画で検証不能"
      ]
    },
    {
      "invariant_id": 4,
      "score": 4,
      "evidence": "debug5(グレードのみ・煙なし)で確認: 暗部は青緑に濁り黒潰れなし、背景は暗い書き割り(窓状の微かな矩形群)+赤/青の大きなボケ光帯、人物輪郭は右縁が赤・左縁が青の対向リムで縁取られている。final.pngでも背景ボケと夜のグレードは維持。減点理由: 最終合成ではシアンの発光帯が支配的になり、赤リムが右肩・頭部右の細いマゼンタの縁(crop.png右側の白帯外縁)まで痩せて「赤/青の対向」の読みが弱まる",
      "reject_reasons": [
        "最終合成で赤リムがマゼンタの細い縁に痩せ、対向リムの対比が弱い"
      ]
    },
    {
      "invariant_id": 5,
      "score": 3,
      "evidence": "静止画では直接判定不能(判定の限界を明記する)。間接証拠: debug2で密度が両腕・手の先端(動きの大きい部位)に集中し胴には薄い=注入量の運動変調は示唆される。しかし反証できない疑いが残る: debug1のシルエットとdebug4のSDF帯は全周が完全に無傷・一様幅で、煙が最も濃い手の輪郭ですら後退も欠けもしていない。「速く動いた部位ほど侵食が深まる」の痕跡が帯幅にもシルエットにも一切現れておらず、侵食変調が存在しないか極めて弱い可能性が高い",
      "reject_reasons": [
        "debug4のSDF帯が全周一様幅で、部位による侵食深さの差が皆無",
        "debug1のシルエットが完全に無傷で、縁の後退(溶け)が確認できない",
        "静止画のため2時間スケール(溶ける/戻る)は原理的に検証不能"
      ],
      "fix_instructions": [
        "運動場で侵食の「深さ」自体を変調すること: フレーム差分をEMA(α=0.15)した運動場をシルエットしきい値に加算し、速く動いた部位でSDF帯がシルエット内側へ食い込むようにする。侵食深さ係数を+50%から試し、debug4で帯幅が部位により2倍以上変化して見えるまで上げる",
        "溶解と再構成を別係数の2時間スケールに分離すること: 侵食は速い時定数(τ≈0.3s)、静止時の実体回復は遅い時定数(τ≈2s)でEMAする(単一時間スケール禁止)",
        "注入量の変調だけで済ませないこと: 帯SDFそのものを運動場で押し込み、debug1のシルエット縁が動いた部位で実際に後退して見えることをスクリーンショットで確認する"
      ]
    },
    {
      "invariant_id": 6,
      "score": 4,
      "evidence": "final.png右下の暗部(880,560-1080,740)の等倍拡大で微細なフィルムグレインを確認、暗部グラデーションにバンディングは見つけられなかった(ディザが効いている)。crop.pngでも発光帯・暗部の双方に粒状が乗り、のっぺりしたデジタル面は見当たらない。減点理由: グレインが静的(セル座標シードのみ・時間不混入)かどうかは静止画1枚では検証不能なため満点は付けない",
      "reject_reasons": [
        "グレインの静的性(フリッカ有無)は静止画で検証不能"
      ]
    }
  ],
  "common": {
    "style_holds": 4,
    "subject_readable": 4,
    "artifact_free": 4
  },
  "verdict": "fail",
  "summary": "溶解帯を源とする本物の流体(渦・上昇・障害物回避をdebug2で確認)と夜のグレード・グレインは成立しており、オーバーレイ偽装の疑いは反証された。しかし不変量5(動きへの応答)が不合格: debug1/debug4でシルエットとSDF帯が全周無傷・一様幅のままで、速く動いた部位の侵食(縁の後退)の痕跡が皆無。注入量の変調はあっても「溶けていく」進行が絵に現れていない。運動場による侵食深さの変調と溶解/再構成の2時間スケール分離を実装し、debug4で帯幅の部位差が見えるまで強めること。付随して、煙の高密度芯が白まで飽和しない点と、最終合成で赤リムが痩せる点も次反復で改善余地あり。"
}
