{
  "artifact": {
    "file": "loop/state/kirie-sekai/shots/final.png",
    "screenshots": [
      "shots/small_final.png",
      "shots/small_night.png",
      "shots/final.png",
      "shots/final_warm.png",
      "shots/final_day.png",
      "shots/final_night.png",
      "shots/final_sepia.png",
      "shots/crop_day_person.png",
      "shots/crop_day_window.png",
      "shots/crop_night_center.png",
      "shots/crop_knob_1x.png",
      "shots/crop_night_knob_1x.png",
      "shots/crop_wall_1x.png",
      "shots/zoom_head.png",
      "shots/zoom_wall.png",
      "shots/final_d1.png",
      "shots/final_d2.png",
      "shots/final_d3.png",
      "shots/final_d4.png"
    ]
  },
  "stance": "reject-seeking",
  "first_impression": "brief 未読の状態で small_final.png は『重ねた色紙から切り出した室内のイラスト — 窓のある部屋に立つ黒髪の人物』に見えた。輪郭ごとに段差と縁取りがあり、単なる減色/ポスタライズではなく積層工芸として読める。ただし窓まわりの光沢と太い暗色の縁取りに、紙というよりゲル/成形プラスチックに寄る瞬間がある。",
  "scores": [
    {
      "invariant_id": 1,
      "score": 4,
      "evidence": "final_d2.png(量子化レベルのみ)で全画面が6〜8段のフラット層に分解され写真階調が消えていることを確認(セーター内部の実測 lum sd=0.49 で完全平坦、紙グレインあり)。crop_knob_1x.png のノブは上縁ハイライト(実測 lum 229 vs 面 205)+下側の落ち影(76〜97)で紙の厚みとして読める。final_day.png x210 の窓ガラス上縁もハイライト 248→面 235、下縁は影 36〜49 で厚みが成立。疑い(ただのポスタライズ偽装)は d2/クロップで反証できた。残る減点: crop_day_window.png の白い窓面に実写由来の連続階調の曇り(C字状の淡い筋)が残り、暗いフレームの角に濡れたようなグロスがあって紙のマット感を局所的に裏切る。",
      "reject_reasons": [
        "crop_day_window.png: 白ガラス面内部にソースの連続階調が薄く残存(完全平坦ではない)",
        "窓フレーム角の光沢筋が紙でなくゲル/樹脂の質感に読める箇所がある"
      ]
    },
    {
      "invariant_id": 2,
      "score": 4,
      "evidence": "face 3x 拡大(final_day/night/sepia/final/final_warm の顔領域を NEAREST 3倍で精査)とcrop_day_person.png / zoom_head.png で、全境界が滑らかなハサミ曲線で 1〜2px の鋸歯・ちぎれ粒・糸を確認できず。d2 の量子化レベル像でも飛び地の confetti なし。目・眉・鼻・ノブなど最小紙片はすべて判別可能サイズ以上。軽微: 鼻の紙片上に 1px 級の白いグレイン輝点が1つ(final 3x 拡大で視認)、窓ガラス内の細い C 字筋(幅2〜3px)が最小紙片サイズ未満の形として薄く残るが、いずれも detached な粒ではなくエンボス程度。",
      "reject_reasons": [
        "鼻の紙片に 1px 級の白色輝点(グレインのスパイク)",
        "窓ガラス内の幅 2〜3px の細い筋状マークは最小紙片フロア未満"
      ]
    },
    {
      "invariant_id": 3,
      "score": 3,
      "evidence": "day フレーム内は概ね一貫(光源=左上): 窓ガラス上縁ハイライト248/下縁影36〜49、壁帯→床の影は常に下側(final_day x80: 164→91→127)、ノブも上縁ハイライト+下側影(radial 実測)。しかし (a) final_night.png のノブは明るい縁が『下側』に反転(下方向 r=28-30 で lum 190〜202、上方向は 99〜145 の影)しつつ、同じ夜フレーム内の壁帯→床の影は下側(117→85)のままで、フレーム内で光源方向が矛盾する。crop_night_knob_1x.png で下弦の強い光帯として明瞭。(b) 頭部(最も目立つ被写体)の髪境界は光源側を含む全周が近黒のリング(実測: 髪上縁 x510 で壁128→21×約8px→髪59、右縁 y250 でも 21〜23)で、『上の層が下の層に落とす一方向の影』でなく全周縁取り=ランダムな縁取り読みを誘発。切り口ハイライトが光源側だけに付いているか、の検査に頭部と夜ノブが不合格。",
      "reject_reasons": [
        "夜プリセットのノブだけ切り口ハイライトが下側に反転し、同フレームの落ち影方向(下)と矛盾",
        "頭部の髪境界が光源側(上)を含む全周で近黒リング(lum 21 vs 髪 59、幅約8px)になり、一方向の層影という奥行き規則を破る"
      ],
      "fix_instructions": [
        "因果診断(1階): 夜ノブの下弦の明帯は、切り口ハイライトのオフセット方向が全画面の単一光源ベクトルからでなく層値やプリセット別の局所規則から算出されている(または夜のみ発光グロー項が加算されている)ことを示す。擬似 sdf 帯のオフセット計算を確認し、uLightDir 相当の単一ベクトルを全プリセット・全境界で共有すること",
        "処方(2階): 切り口ハイライトは境界 sdf の光源側 1〜2px のみに限定し、反対側は短く柔らかい落ち影のみとする。夜プリセットでもハイライト側=光源側を維持(発光演出が欲しいなら窓ガラスの面色でやる)。頭部の全周近黒リングは edge darkening の係数過大が原因 — edge darkening を『影側半周のみ・現在の 1/3 以下』に減衰し、光源側半周では darkening を 0 にして細いハイライトへ置換する(ref_1_hijab.jpg には黒い輪郭線が一切ない点に合わせる)"
      ]
    },
    {
      "invariant_id": 4,
      "score": 4,
      "evidence": "final_d4.png に各プリセットの設計済み紙スワッチ(冷茶系/暖夜系/セピア系)が確認でき、final_d2.png の主要色は約6〜8トーンのクラスタ(43,64,65 / 216,202,167 / 176,164,133 / 108,132,116 / 65,98,93 …)に収束、グレインによる微揺らぎのみ。day/night/sepia とも全レイヤーが同一の紙セットから切られた統一感があり、実写色のポスタライズ読みは d1(量子化場)との対比で反証できた。減点: final_night.png のノブが彩度の高い暖橙+下側の光帯で『紙』でなく『発光体(ランプ)』として浮き、夜の紙セットの統一からわずかに逸脱する。",
      "reject_reasons": [
        "夜プリセットのノブが emissive(発光)読みになり、同じ紙から切った統一感を局所的に破る"
      ]
    },
    {
      "invariant_id": 5,
      "score": 4,
      "evidence": "V1 運動応答 pass(unfrozen mean|Δ|=6.276/255 で追従、freeze Δ=0.000 で完全静止)。静止画側にも沸き立ちの痕跡(境界の毛羽・多重露光的な残像)は crop_knob_1x.png / zoom_head.png に見られず、グレインは cell-hash 由来の固定パターンとして面に密着している。V1 pass のため静止画で時間性を確認できないことは減点理由にしない。5 にしないのは、しきい値 ema+hysteresis のシーン急変時の挙動(層の張り替わりのポップ)が静止画からは検証不能なため。",
      "reject_reasons": [
        "シーン急変時の quantile しきい値ポップは静止画から検証不能(留保)"
      ]
    },
    {
      "invariant_id": 6,
      "score": 3,
      "evidence": "目・眉・口を全5ショットで個別確認(顔領域を NEAREST 3倍拡大): 目=濃色の楕円紙片が day/night/sepia/final/final_warm すべてで明瞭、眉=目の上の弧状紙片が同じく全プリセットで明瞭。しかし『口』はどのプリセットにも独立した紙片として存在しない — 鼻の紙片の付け根に貼り付いた影色の短い横ダッシュ(final_day 3x で teal、final_night 3x で紺)があるのみで、位置が鼻先直下すぎて鼻下の影として読め、口とは判読できない。ref_2/ref_3/ref_4 では唇が明確に独自の紙片を持つのと対照的。顎から下は無地で口の痕跡なし。3点中2点(目・眉)のみ成立のため 3。",
      "reject_reasons": [
        "口が全プリセットで欠落(鼻の付け根の影ダッシュのみで、口として判読不能)"
      ],
      "fix_instructions": [
        "因果診断(1階): 口は目・眉より低コントラストの中サイズ構造のため、『暗部の小面を最暗トーンとして保持する量子化下限』の保護に掛からず中間層へ吸収されている。d1(量子化場)では口の位置に暗い小面が存在するので、局所コントラスト細分の感度不足が原因",
        "処方(2階): 鼻下〜顎の帯(顔の下 1/3、画面中央の高コントラスト小構造)に対して quantile 段の局所細分のしきいを下げ、口幅相当(目の紙片と同程度〜1.5倍)の暗い横長小面を最暗トーンの独立紙片として存続させる。鼻の紙片と融合しないよう、鼻ピースの下端と口ピースの間に人中1〜2px分の分離を最小帯幅フロアの例外として許す(ref_2_curls_man.jpg の『目・唇だけ精密』の秩序に合わせる)"
      ]
    }
  ],
  "common": {
    "style_holds": 4,
    "subject_readable": 4,
    "artifact_free": 4
  },
  "verdict": "fail",
  "summary": "第一印象から積層ペーパーカットとして成立しており(ポスタライズ読みは d2 と切り口/落ち影の実測で反証)、平坦な面・限定パレット・滑らかなハサミ曲線・V1 の完全静止は堅い。落第点は2つ: (1) inv3=3 — 夜プリセットのノブで切り口ハイライトが光源と逆の下側に反転し(実測 lum 190〜202)、同フレームの落ち影方向と矛盾。さらに頭部の髪境界が光源側を含む全周近黒リング(lum 21)で、一方向の層影という風景箱の奥行き規則を破る。(2) inv6=3 — 目・眉は全プリセットで紙片として明瞭だが、口が全プリセットで欠落(鼻の付け根の影ダッシュのみ)。修正は edge darkening の影側半周限定化+単一光源ベクトルの全プリセット共有、および口領域の量子化局所細分の2点に集中すればよい。"
}
