{
  "artifact": {
    "file": "loop/state/taifu-no-me/index.html",
    "commit": "68fdfdb",
    "screenshots": [
      "loop/state/taifu-no-me/shots/final_warm12s.png",
      "loop/state/taifu-no-me/shots/final_thumb.png",
      "loop/state/taifu-no-me/shots/final_freeze.png",
      "loop/state/taifu-no-me/shots/crop_eyewall.png",
      "loop/state/taifu-no-me/shots/crop_outer.png",
      "loop/state/taifu-no-me/shots/debug_1.png",
      "loop/state/taifu-no-me/shots/debug_2.png",
      "loop/state/taifu-no-me/shots/debug_3.png",
      "loop/state/taifu-no-me/shots/debug_4.png"
    ]
  },
  "stance": "reject-seeking",
  "first_impression": "縮小版(final_thumb)を先に見た第一印象: 濃紺の丸い穴を中心に、青みがかった灰白色の雲の環が二重に取り巻き、四隅は減光している。台風の目を気象衛星から俯瞰した図に読めるが、縮小スケールでは二重のほぼ同心リング+丸い暗中心という構図が『虹彩+瞳孔(眼球)』の読みと競合する。瞳孔化を断つ緩和(中心が純黒でなく濃紺の海色、境界が真円でなく左にえぐれた歪み、繊維でなく等方mottle)は効いているが、縮小時は螺旋の腕が読みづらく眼球ゲシュタルトを完全には振り切れていない。",
  "scores": [
    {
      "invariant_id": 1,
      "score": 4,
      "evidence": "debug_1(速度場)は中心を黒く抜いた周囲で色相が一周する回転流で、無方向乱流ではなく大域回転が確立している。debug_3(注入ゲート)とdebug_2(密度raw)に中心へ巻き込む複数の弧が切れ間つきで見え、final_warm12s/final_freeze でも下側から回り込む明るい腕と上右の切れ間が読め、『ただの煙・乱流』という反証は成立しない。減点理由: 縮小版(final_thumb)では帯がほぼ同心リングに退行して見え、対数螺旋の非対称性(腕らしさ)が一目で読めるとは言い切れない。",
      "reject_reasons": [
        "final_thumb では二重の帯が同心リング寄りに見え、対数螺旋の巻き込みが縮小スケールで弱い(A6②同心リング=虹彩筋リスクの残り火)",
        "全体のボケで螺旋の腕の輪郭がシャープに立っていない"
      ]
    },
    {
      "invariant_id": 2,
      "score": 4,
      "evidence": "final_warm12s/final_freeze/crop_eyewall で中心の静穏領域が一貫して維持され雲で埋まっていない。目の内側は純黒でなく深い濃紺(海面色)で、crop_eyewall では目の直近を明るい雲の環(アイウォール)が縁取る。debug_3 では中心の散逸ゲート(青円)の外周に最も明るい注入(オレンジ環)が置かれ、アイウォール設計が確認できる。『目が埋まる/海色が出ない』反証は成立しない。減点理由: 可視最終像でのアイウォール環と外側帯の濃度差が中程度で、『最も濃い雲の壁』のコントラストが劇的ではない。",
      "reject_reasons": [
        "final の可視アイウォールが周囲帯より決定的には濃くなく、『最も濃い壁』の読みが中程度",
        "目境界の左のえぐれが大きく、目の『円形』性はやや弱い(ただしA6④の崩し要件とはトレードオフ)"
      ]
    },
    {
      "invariant_id": 3,
      "score": 4,
      "evidence": "静止画から時間挙動は直接判定しない方針に従い、場と計測で担保を確認。debug_1 は輝度(速度の大きさ)が目の境界付近の環で最大、中心は黒(≒静止)、外側へ緩やかに減衰しており、ランキン渦プロファイル(半径増で速度増→アイウォール最大→内側急減)が外力場として実装されている。V1計測(中心2秒差分=0.0=設計どおりの静止、レインバンド12.8/10.2の健全応答、time担保済み)とも整合し、『全体が一様に回る』反証は成立しない。",
      "reject_reasons": []
    },
    {
      "invariant_id": 4,
      "score": 3,
      "evidence": "crop_outer/crop_eyewall(等倍)と debug_4(陰影標本)に濃淡まだら(mottle)は確かに存在し、A1の完全飽和した平坦白膜=石膏には陥っていない。しかし反対極=軟らかいヘイズで立体感不足(inv4)を反証できない: crop_outer は雲がボケた綿状で、光方向の自己遮蔽による『沸き立つ塊(積乱雲の雲頂)』の峰谷が読み取れない。crop_outer 中央の斜めの暗帯は弱い陰りに留まり、隆起した細胞状の塊としての自己遮蔽になっていない。debug_4 の陰影標本は等倍最終像より mottle が細かく、実描画側でボケが高周波を潰して質感を殺している疑いが強い。",
      "reject_reasons": [
        "crop_outer が軟らかいヘイズ/綿でのっぺりし、峰谷の自己遮蔽(隆起)が読めない(CRAFT §A3: 法線をなめらかな低解像度場のみから計算した粘土化の症状)",
        "debug_4 の方が等倍 crop より mottle が細かく、最終描画のボケが雲頂の高周波質感を潰している",
        "自己遮蔽の方向性が一貫して読み取れず、まだらが3Dの隆起でなく2Dのシミに留まる"
      ],
      "fix_instructions": [
        "1階(因果診断): CRAFT §A3(照明が微細ディテールを見ないと粘土)+ inv4 の軟らかいヘイズ極。証拠=crop_outer が綿状でのっぺり、debug_4 の陰影標本より等倍最終像の mottle が明らかに粗い(=最終段のボケが高周波を消している)、自己遮蔽の隆起方向が読めない。法線がなめらかな密度勾配のみから計算され高周波ディテールを見ていない。lookの色設計(inv5)は変えない範囲で是正すること。",
        "2階(処方・数値方向): 法線を『なめらかな密度勾配 + ディテールノイズの有限差分勾配』の合成に変更し、光方向へ場を2タップ+ノイズ1タップ行進する自己遮蔽を強める。塊の谷間にクレバスAOを足し、受光縁に控えめなシルバーライニングを置いて雲頂を隆起として立たせる。",
        "2階(処方・数値方向): 密度/陰影段のボケ半径を下げて mottle の空間周波数を上げ、等倍(crop_outer)で沸き立つ細胞状の峰谷が読めるようにする。同時に curl noise 由来 mottle をゲインの主成分に引き上げつつ注入上限を下げ、密度を0.6〜0.85帯に保って飽和(→勾配ゼロ=A1)を回避する。"
      ]
    },
    {
      "invariant_id": 5,
      "score": 4,
      "evidence": "final_warm12s で雲は低彩度の青みがかった白〜灰、雲の切れ間と目の内側は深い濃紺(海色)、四隅は減光して衛星視野のビネットが効いている。最明部(アイウォール下部)も純白飛びせず灰白に抑えられ白上限が守られる。debug_4 下部の色ランプ(濃紺→灰→白)が oklab 補間設計を裏づける。『派手色/純白飛び』の反証は成立しない。減点理由: アイウォール下部の白パッチが局所的にかなり明るく、白上限0.9の余裕は大きくない。",
      "reject_reasons": [
        "アイウォール下部の明部が局所的に白に迫り、白上限の余裕が小さい"
      ]
    },
    {
      "invariant_id": 6,
      "score": 4,
      "evidence": "静止画からは直接判定不可のため計測と場で担保を確認。V1 longrun が pass(平均輝度 100→103 でほぼ不変、white 0.00%、whiteout なし、time担保済み)。debug_3 に中心(青)の散逸ゲートと距離依存の注入テーパが確認でき、CRAFT §A5 の有界定常状態の処方(clamp/距離依存散逸/白上限手前)が実装されている。『発散・消失』の反証は成立しない。",
      "reject_reasons": []
    }
  ],
  "common": {
    "style_holds": 3,
    "subject_readable": 4,
    "artifact_free": 4
  },
  "verdict": "fail",
  "summary": "眼球化(§A6)の3要素は個別には緩和されている: ①中心は純黒真円でなく濃紺(海色)の歪んだ穴、②テクスチャは等方mottleで接線繊維/放射なし、③目境界は移流で崩れ debug_3 の生sdf円は最終描画に露出していない。渦(id1/debug_1・debug_3)・目とアイウォール(id2)・ランキン速度場(id3)・色設計(id5)・定常性(id6, longrun pass)は反証できず≥4。しかし verdict=fail の理由は2点。(A) 物質感(id4)=3: mottle はあるが軟らかいヘイズで峰谷の自己遮蔽が読めず、debug_4 より等倍最終像の質感が粗い=最終段ボケが高周波を潰している。法線合成・自己遮蔽・ボケ半径/mottleゲインの是正で pass 圏。(B) style_holds=3: 個別緩和は効くが縮小版(final_thumb)では二重のほぼ同心リング+丸い暗中心が眼球ゲシュタルトと競合し、螺旋の腕が一目で読めない。処方=スパイラル角を上げ外側帯の切れ間を増やし、縮小スケールでも同心リングでなく対数螺旋として読めるようにする。全不変量≥4かつcommon全軸≥4を満たさないため fail。"
}
