{
  "artifact": {
    "file": "fable5_itsuwari-hyomen.html",
    "screenshots": [
      "loop/state/itsuwari-hyomen/shots/small_final.png",
      "loop/state/itsuwari-hyomen/shots/small_intact.png",
      "loop/state/itsuwari-hyomen/shots/F1_final_warm.png",
      "loop/state/itsuwari-hyomen/shots/F2_intact.png",
      "loop/state/itsuwari-hyomen/shots/crop_hole_edge.png",
      "loop/state/itsuwari-hyomen/shots/crop_intact_face.png",
      "loop/state/itsuwari-hyomen/shots/crop_pile.png",
      "loop/state/itsuwari-hyomen/shots/F3_dbg1_mask.png",
      "loop/state/itsuwari-hyomen/shots/F4_dbg2_bw.png",
      "loop/state/itsuwari-hyomen/shots/F5_dbg3_blocks.png",
      "loop/state/itsuwari-hyomen/shots/F6_dbg4_specimen.png"
    ]
  },
  "stance": "reject-seeking",
  "first_impression": "暖色の室内（窓・吊りランプ・棚の本）に立つ赤い服の人物の表面が中央から剥がれ、無数の小さな正方形の破片となって降り注ぎ画面下に山を作っている。剥がれた穴からは灰色で味気ない下地の世界が覗く——「表面が貼りものだった人物と部屋」に見え、テーマ『偽りの表面』の被写体・現象と一致する。",
  "scores": [
    {
      "invariant_id": 1,
      "score": 5,
      "evidence": "F2_intact と crop_intact_face（等倍）を全面走査したが、継ぎ目・格子・タイル感は皆無——顔の肌グラデ、服の斜めストライプ、壁の縦シェーディングはすべて連続で、剥離グリッド（F3 のセルは約25px。壁の縦縞は幅40px超のソフトな照明ムラでピッチも硬さも別物）と対応する周期構造は存在しない。一方 F1_final_warm では剥離して初めて正方形ブロックと穴縁の角欠け（crop_hole_edge 右側、肩まわりのセル形の欠け）としてグリッドが現れる。F3 のマスクがセル解像度で管理され合成時に切替えている構造も確認——無傷面に継ぎ目が原理的に出ない設計で、騙し絵の反転が成立している。",
      "reject_reasons": [
        "無傷面に格子が透ける可能性 → crop_intact_face 等倍で反証（連続グラデのみ）",
        "壁の縦縞がタイル継ぎ目である可能性 → 幅・ソフトさ・ピッチが F3 のセル格子（約25px）と不一致、照明ムラと判断し反証",
        "事前タイル分割を全面ブラーで隠している可能性 → F2 のボケは絵柄の様式で一様、ブロック境界に沿う局所的なぼかし帯は無く反証"
      ]
    },
    {
      "invariant_id": 2,
      "score": 5,
      "evidence": "F5_dbg3（ブロックのみ）で落下中の個体が広い角度分布で回転し、下部で2つの山なり（マウンド）に堆積。等間隔・整列・同位相は crop_pile 等倍でも確認できない——傾き・重なり・隙間がランダムで、ref_pile_kotonoha.png の堆積（傾いた個体が支え合う山）と同質。針山（CRAFT E2）も宙吊りも無く、山の裾は自然に広がる。F1 でも堆積は穴の直下（人物の裾・左の壁下）に対応した位置にできている。落下・衝突の時間挙動そのものは V1 運動応答 pass（mean|Δ|=9.706/255、落下ブロックの運動を含む）が担保。",
      "reject_reasons": [
        "整列・等間隔・同位相の落下 → F5/crop_pile の角度・位置分布のランダム性で反証",
        "針山化・宙吊り（CRAFT E2） → 山なり形状と接地した積層で反証",
        "深い相互めり込みで物理が偽物の可能性 → crop_pile の重なりは描画順の前後関係の範囲で、ref_pile_kotonoha の字の重なりと同程度。反証"
      ]
    },
    {
      "invariant_id": 3,
      "score": 5,
      "evidence": "F1/crop_hole_edge で各ブロックの中身が元位置の絵柄と対応——顔の穴の近傍には眉・肌色の断片を持つブロック、窓の右下には空色ブロック、服の領域は赤縞、壁下は灰色、棚下には黄（本）。crop_pile でも白（服の楕円飾り）・赤・肌・灰が混在し UV の出自が読める。F6_dbg4（標本）2段目にスナップショット世代の標本が4枚並び（フルカラー→減彩→灰→暗転）、凍結テクスチャの世代機構が実装として存在することを確認。凍結（破片内が止まり裏世界だけ動く）の時間性自体は静止画で判定せず、V1 運動応答 pass（裏世界のライブ性を含む）に委ねる。",
      "reject_reasons": [
        "ブロックがライブ映像を映す『動く窓』の可能性 → 静止画では直接判定不可だが、F6 の世代標本がスナップショット凍結の実装を示し、V1 pass と併せ反証",
        "中身が出自と無関係なランダム色の可能性 → 顔断片・窓色・服縞の位置対応で反証"
      ]
    },
    {
      "invariant_id": 4,
      "score": 5,
      "evidence": "画素実測で反証を試みた: F4_dbg2（裏世界全面）は meanSat=0.000（完全無彩）。最終合成 F1 の露出穴も meanSat=0.005〜0.027（warm グレードの残滓程度、p90 でも 0.077 以下）に対し無傷の服は meanSat=0.672——彩度ゼロが合成後も保たれる。暗さも実測で、穴領域 meanLum=88.7〜122.6 に対し同座標の無傷面（F2 同ボックス）は 167.5 と、裏世界は明確に沈む。F4 には sobel 由来の黒い輪郭線（頭部・眉・窓枠・棚）と少数トーンのポスタライズ面（F6 上段に無彩5トーンの標本スウォッチ）があり、ref_bw_world_overflowing_aura.png の『検知結果の可視化』的な味気なさと同系。裏世界の被写体の動きは V1 pass（裏世界のライブ性を含む）が担保。",
      "reject_reasons": [
        "裏世界に彩度が残る可能性 → 実測 meanSat=0.000（F4）/穴領域 0.005〜0.027（F1）で反証",
        "裏世界が明るく表との対比が立たない可能性 → 実測 meanLum 88.7〜122.6 vs 167.5 で反証",
        "輪郭線が無く単なるグレースケール化の可能性 → F4 の頭部・窓枠・棚の黒輪郭と F6 のポスタライズ標本で反証"
      ]
    },
    {
      "invariant_id": 5,
      "score": 5,
      "evidence": "F3_dbg1（剥離マスク）で崩壊は有限の連結ブロブ2〜3個（クリック起点数個分）に留まり、画面の大半のセルは無傷——1クリック全崩壊ではない。ブロブ境界は円形 sdf のスタンプではなく、確率的伝播に特有の不規則な凹凸・ローブ・飛び地セル（左端の孤立セル、F1 の左の微小欠け）を持つ。周縁にオレンジのセル帯が赤コアを縁取っており、境界で時間差の状態遷移（追い崩れ/回復の前線）が走っている構造証拠。追い崩れの時間挙動そのものは静止画で判定せず V1 pass に委ねるが、静止構造（穴形状・前線・収束した有限半径）はすべて不変量と整合。",
      "reject_reasons": [
        "1クリックで全面崩壊 → F3 で大半のセルが無傷のまま、反証",
        "穴が sdf の生円（伝播なしの一撃スタンプ）→ 不規則ローブ+飛び地セル+周縁の別状態セル帯で反証",
        "崩壊が収束せず広がり続ける可能性 → V1 長時間安定 pass（mean 136.4→136.5）で反証"
      ]
    },
    {
      "invariant_id": 6,
      "score": 5,
      "evidence": "構造証拠: F3 のオレンジセルが穴の『端』に沿って帯状に分布——フェード一様回復でなく端から埋まる遷移と整合。F6 標本2段目のスナップショット世代ランプ（カラー→減彩→灰→暗転）は破片が退色して白黒世界へ同化するランプの実装を示す。F1 の左下堆積は既に大半が無彩の淡灰で、彩度を落とした古い破片の読みと整合。有界性は実測と V1 で: 長時間安定 pass の mean 136.4→136.5/255 は、私が実測した無傷フレーム F2 の全面 meanLum=136.5 と一致——長時間放置で画面が『いつも通り』の近傍に留まる（修復平衡）ことの強い証拠。whiteout 0.00% で発散も枯渇もない。回復の時間経過そのものは静止画で判定しない（V1 pass）。",
      "reject_reasons": [
        "修復が存在せず崩し尽くしで終わる可能性 → 長時間 mean が無傷時の実測値 136.5 と一致し続けることで反証",
        "堆積が無限に増えて破綻（CRAFT A5 系）→ whiteout 0.00%・堆積高さが画面下部 1/4 程度に留まることで反証",
        "回復が全面フェード（端から埋まらない）可能性 → F3 の穴縁に沿ったオレンジ状態帯で反証"
      ]
    }
  ],
  "common": {
    "style_holds": 5,
    "subject_readable": 5,
    "artifact_free": 4
  },
  "verdict": "pass",
  "summary": "手順0の第一印象（表面が貼りものだった人物と部屋が剥がれ、破片が積もり、灰色の味気ない下地が覗く）がテーマと一致。全6不変量とも拒否理由を立てて反証を試みたが、いずれも画像証拠と画素実測（裏世界 meanSat=0.000、穴領域 0.005〜0.027、穴は同座標の無傷面より 45〜79 明度低い、長時間 mean が無傷実測 136.5 に一致）で反証された: 無傷面は等倍でも継ぎ目ゼロ（inv1=5）、堆積は回転を伴う自然な山（inv2=5）、破片は出自UVの凍結像を携え世代標本も存在（inv3=5）、裏世界は完全無彩+輪郭+ポスタライズで暗く沈む（inv4=5）、崩壊は有限ブロブ+不規則な伝播前線（inv5=5）、修復平衡と退色ランプの構造証拠（inv6=5）。唯一の留保は artifact_free=4: 左の穴の境界の一部がフェザー状に柔らかく、縮小では剥離穴というより煙の染みに読み得る（マスク境界のワープ処理の副作用と見られるが、破綻ではなく減点1に留める）。時間挙動は V1 運動応答/長時間安定の両 pass に委ね、静止画からの時間性の推定はしていない。verdict: pass。"
}
